{
  "schemaVersion": "lfe.baseline/0.1",
  "id": "DESIGN-002",
  "revision": 1,
  "title": "Painéis A/B/C",
  "medium": "figma",
  "fidelity": "editable-frames",
  "sourceUrl": "https://www.figma.com/design/EXEMPLO",
  "screens": [
    {
      "screenId": "UI-010",
      "name": "Catálogo",
      "goal": "Explorar coleções",
      "states": [
        "default"
      ],
      "viewports": [
        {
          "width": 1440,
          "height": 900
        }
      ],
      "preview": {
        "path": "docs/design/previews/catalogo.png"
      }
    }
  ],
  "files": [
    {
      "path": "docs/design/previews/catalogo.png",
      "sha256": "sha256:5d30794986031e3a7ad53838070603fc4b34e12ec6f47f0709aba42ccc025730"
    }
  ]
}
